{"$schema":"https://json-schema.org/draft/2020-12/schema","$id":"https://carbonactual.local/schema/ecosystem-handoff.v1.json","title":"Carbon Actual Canonical Cross-Product Handoff","type":"object","additionalProperties":false,"required":["schema_version","handoff_id","from","to","responsibility","context","authority_scope","state","evidence","dependencies","obligations","acceptance","status","next_owner"],"properties":{"schema_version":{"const":"1.0.0"},"handoff_id":{"type":"string","minLength":1},"from":{"type":"string","minLength":1},"to":{"type":"string","minLength":1},"responsibility":{"type":"string","minLength":1},"context":{"type":"object"},"authority_scope":{"type":"string","minLength":1},"state":{"type":"string","minLength":1},"evidence":{"type":"array","items":{"type":"string"}},"dependencies":{"type":"array","items":{"type":"string"}},"obligations":{"type":"array","items":{"type":"string"}},"acceptance":{"type":"string","minLength":1},"status":{"enum":["sent","delivered","acknowledged","accepted","rejected","partially_accepted","escalated","completed","expired"]},"next_owner":{"type":"string","minLength":1}}}
