{"schema_version":"1.0.0","handoff_id":"handoff.example.001","from":"spotist","to":"omni-economic","responsibility":"Continue an authorized economic seek after SPOTIST has qualified the candidate set.","context":{"seek_ref":"seek:example","domain":"economic-participation"},"authority_scope":"Use existing human/entity authority carried in the originating seek; no new authority is granted by the handoff.","state":"qualified_candidates_ready","evidence":["evidence:candidate-1","evidence:verification-1"],"dependencies":["cap.discovery","cap.matching"],"obligations":["preserve_seek_constraints","preserve_provenance"],"acceptance":"Receiving capability must acknowledge or reject the handoff without losing the originating state.","status":"sent","next_owner":"omni-economic"}
